{
  "schema": "noumena.patch.v1",
  "clientPatchId": "set-status-fixture",
  "base": { "revision": "sha256:fixture", "logicalVersion": 1, "blockHashes": {} },
  "author": { "type": "agent", "name": "fixture" },
  "intent": "Set status",
  "ops": [{ "op": "set_status", "target": { "role": "metadata" }, "status": "active" }]
}
